{
  "laterality": "OD",
  "targetRefractionSphericalEquivalent": 0.0,
  "axialLength": 22.86,
  "keratometryExists": true,
  "keratometryDeltaKExists": true,
  "totalKeratometryExists": true,
  "totalKeratometryDeltaKExists": true,
  "KeratometryR1": 7.97,
  "KeratometryK1": 42.34,
  "KeratometryA1": 0.0,
  "KeratometryR2": 7.83,
  "KeratometryK2": 43.09,
  "KeratometryA2": 100.0,
  "KeratometryCyl": 0.22,
  "KeratometryCylAxis": 106.0,
  "KeratometrySE": 42.32,
  "KeratometryCR": 4.0,
  "totalKeratometryR1": 7.75,
  "totalKeratometryK1": 42.43,
  "totalKeratometryA1": 0.0,
  "totalKeratometryR2": 7.84,
  "totalKeratometryK2": 43.04,
  "totalKeratometryA2": 100.0,
  "totalKeratometryCyl": 0.16,
  "totalKeratometryCylAxis": 142.0,
  "totalKeratometrySE": 42.44,
  "totalKeratometryCR": 7.95,
  "acd": 3.06,
  "acdMeasurementSource": "EPITHELIUM",
  "incisionOrientation": 45.0,
  "sia": 1.4,
  "refractiveIndex": 1.3375,
  "planCreationDate": "2022-12-27",
  "surgeon": "Dr. Who",
  "planCreator": "Christina Hernandez",
  "warnings": [],
  "iolName": "Eyecryl Toric",
  "manufacturerName": "Biotech Vision",
  "variantName": "M",
  "formulaName": "Haigis Suite",
  "useTk": false,
  "seBased": true,
  "estimatedLensPosition": "4.24",
  "calculatedIol": {
    "iolRefractivePowerSphericalEquivalent": 24.5,
    "iolRefractivePowerSphere": 23.375,
    "iolRefractivePowerCylinder": 2.25,
    "iolRefractivePowerAxis": 100.0,
    "residualRefractionSphericalEquivalent": 0.06,
    "residualRefractionSphere": 0.32,
    "residualRefractionCylinder": -0.52,
    "residualRefractionAxis": 0.0,
    "residualRefractionAxisFlipping": true
  },
  "toricLens": true,
  "cylinderLabel": "tbd",
  "quantity": 1,
  "surgeryDate": "2023-03-11"
}